{
  "rule_schema_version": 2,
  "meta": {
    "name": "Ведомость амортизации ОС — плоская таблица",
    "source_type": "excel",
    "sheet_name": "Исходная выгрузка 01",
    "profile_hint": "os_depreciation_01"
  },
  "layout": {
    "layout_type": "hierarchy_rows",
    "name_column": 0
  },
  "hierarchy": {
    "leaf_rules": {
      "min_name_length": 20,
      "inventory_patterns": ["\\d{2}\\.\\d{2}\\.\\d{4}", "инв\\.?", "№\\s*[\\dA-Z-]", "80-\\d+", "\\d{6,}"],
      "skip_name_patterns": ["^ОП\\s", "^РТК\\s", "^КЦ$", "^Итого"]
    },
    "levels": [
      {
        "id": "group",
        "target": "Группа",
        "depth": 0,
        "patterns": ["^(Здания|Сооружения|Машины|Земельные|Транспорт|Офисное|Производственный|Другие виды)"]
      },
      { "id": "unit", "target": "Узел", "depth": 1, "patterns": ["^РТК\\s", "^КЦ$"] },
      { "id": "branch", "target": "Подразделение", "depth": 2, "patterns": ["^ОП\\s"] }
    ]
  },
  "columns": [
    { "target": "Юрлицо", "source": { "type": "entity_from_header" } },
    { "target": "Группа", "source": { "type": "hierarchy_field", "field": "group" } },
    { "target": "Узел", "source": { "type": "hierarchy_field", "field": "unit" } },
    { "target": "Подразделение", "source": { "type": "hierarchy_field", "field": "subdivision" } },
    { "target": "ОС", "source": { "type": "hierarchy_field", "field": "asset_name" } },
    {
      "target": "2024 - начало",
      "source": { "type": "metric", "measure": "residual_open", "period_suffix": "{year} - начало" }
    },
    {
      "target": "2024 - амортизация",
      "source": { "type": "metric", "measure": "amort_charge", "period_suffix": "{year} - амортизация" }
    },
    {
      "target": "2024 - конец",
      "source": { "type": "metric", "measure": "residual_close", "period_suffix": "{year} - конец" }
    }
  ],
  "filters": {
    "skip_row_patterns": ["^Итого", "^Группа учета", "^Подразделение$", "^Основное средство", "^Ведомость", "^Выводимые"]
  },
  "output": { "shape": "wide" }
}
